{
  "id": "quareia-tree-of-life",
  "name": "Tree of Life",
  "aliases": [
    "tree of life",
    "tree of life layout"
  ],
  "positions": [
    {
      "key": "1",
      "label": "1 Star Father I · The story is about"
    },
    {
      "key": "2",
      "label": "2 Keeper of Time II · The story is about (present aspect)"
    },
    {
      "key": "3",
      "label": "3 Holder of Light III · The story, withheld aspect"
    },
    {
      "key": "4",
      "label": "4 Light Bearer IV · Necessary, fate gives you"
    },
    {
      "key": "5",
      "label": "5 Imprisoner V · What is withheld"
    },
    {
      "key": "6",
      "label": "6 Pure Balance VI · Centre of situation"
    },
    {
      "key": "7",
      "label": "7 Grindstone VII · Emotions, also needful burden"
    },
    {
      "key": "8",
      "label": "8 Unraveller VIII · Mind, magic / unravelling"
    },
    {
      "key": "9",
      "label": "9 Threshold Guardian IX · Tribe, home, ancestors"
    },
    {
      "key": "10",
      "label": "10 Mother Earth X · Outcome"
    }
  ],
  "decks": [
    "quareia"
  ]
}
